<?xml version="1.0" encoding="UTF-8" standalone="no"?>
<!DOCTYPE music_genres SYSTEM "music_genres.dtd">

<music_genres>
    
    <song>
        <title>Eye of the Tiger</title>
        <group>
            <group_name>Survivor</group_name>
            <formed>1978</formed>
        </group>
        <link url="https://www.allmusic.com/artist/survivor-mn0000039637"/>
        <album img="bilder/eyeofthetiger.jpg" caption="Eye of the Tiger cover"></album>
        <release_date>1982</release_date>
        <duration>04:06</duration>
    </song>

    <song>
        <title>Paint It Black</title>
        <group>
            <group_name>The Rolling Stones</group_name>
            <formed>1962</formed>
        </group>
        <link url="https://www.allmusic.com/artist/the-rolling-stones-mn0000894465"/>
        <album img="bilder/paintitblack.jpg" caption="Paint It Black cover"></album>
        <release_date>1964</release_date>
        <duration>03:20</duration>
    </song>

    <song>
        <title>Good Rockin' Tonight</title>
        <artist>
            <name>Elvis Presley</name>
            <birth>08-01-1935</birth>
            <gender type="male"/>
        </artist>
        <link url="https://www.allmusic.com/artist/elvis-presley-mn0000180228"/>
        <album img="bilder/goodrockintonight.jpg" caption="Good Rockin' Tonight Cover"></album>
        <release_date>1954</release_date>
        <duration>02:12</duration>
    </song>

    <song>
        <title>Dancing in the Dark</title>
        <artist>
            <name>Bruce Springsteen</name>
            <birth>23-09-1949</birth>
            <gender type="male"></gender>
        </artist>
        <link url="https://www.allmusic.com/artist/bruce-springsteen-mn0000530745"/>
        <album img="bilder/dancinginthedark.jpg" caption="Dancing in the Dark cover"></album>
        <release_date>1984</release_date>
        <duration>04:01</duration>
    </song>
    
</music_genres>
